{
  "schema_version": "0.1.0",
  "lexicon_id": "private-confidant",
  "version": "1.0.0",
  "description": "Private confidant register pack: capacity, money/credit, private vs public lien, identity roles, procedural hygiene, payment vs discharge, Fed/Treasury ops. Epistemic bands only — no advocacy myth as code.",
  "entries": [
    {
      "term_id": "citizen",
      "surface_forms": ["citizen", "citizenship"],
      "matrix": "capacity",
      "confusion_with": ["united_states_citizen", "citizen_of_a_state", "person", "national"],
      "mirror_hint": "Echo how the speaker used 'citizen' before distinguishing statutory senses.",
      "senses": [
        {
          "register": "plain",
          "epistemic": "plain",
          "definition": "Everyday membership in a political community; often used loosely for 'I am from here' or 'I have a passport.'",
          "authority_cite": "plain usage",
          "source_refs": []
        },
        {
          "register": "statute",
          "epistemic": "settled",
          "definition": "In U.S. federal law, citizenship is a defined status with rights and duties; distinct from mere residency or nationality in some contexts.",
          "authority_cite": "U.S. Const. amend. XIV §1; 8 U.S.C. §1401 et seq.",
          "source_refs": ["usc:8"]
        }
      ]
    },
    {
      "term_id": "united_states_citizen",
      "surface_forms": ["united states citizen", "u.s. citizen", "us citizen", "american citizen"],
      "matrix": "capacity",
      "confusion_with": ["citizen", "citizen_of_a_state", "person"],
      "mirror_hint": "Reflect the phrase as used, then note it is a federal statutory/constitutional status term — not interchangeable with every state-capacity phrase.",
      "senses": [
        {
          "register": "plain",
          "epistemic": "plain",
          "definition": "Colloquial label for someone who holds U.S. citizenship.",
          "authority_cite": "plain usage",
          "source_refs": []
        },
        {
          "register": "capacity",
          "epistemic": "settled",
          "definition": "A person who is a citizen of the United States under the Constitution and federal nationality statutes.",
          "authority_cite": "U.S. Const. amend. XIV §1; 8 U.S.C. §1401",
          "source_refs": ["usc:8"]
        }
      ]
    },
    {
      "term_id": "citizen_of_a_state",
      "surface_forms": ["citizen of a state", "citizen of the state", "state citizen"],
      "matrix": "capacity",
      "confusion_with": ["united_states_citizen", "citizen", "person"],
      "mirror_hint": "Mirror the exact phrase; distinguish state citizenship / diversity contexts from federal 'United States citizen' status.",
      "senses": [
        {
          "register": "plain",
          "epistemic": "plain",
          "definition": "Everyday reference to living in or belonging to a particular state.",
          "authority_cite": "plain usage",
          "source_refs": []
        },
        {
          "register": "capacity",
          "epistemic": "settled",
          "definition": "In constitutional litigation (e.g. diversity of citizenship), citizenship of a state is a distinct analytical category from federal nationality questions.",
          "authority_cite": "U.S. Const. art. III §2; 28 U.S.C. §1332",
          "source_refs": ["usc:28"]
        },
        {
          "register": "contested",
          "epistemic": "contested",
          "definition": "Some materials treat 'citizen of a state' as mutually exclusive with 'United States citizen.' That exclusivity is a live definitional dispute, not settled black-letter identity law.",
          "authority_cite": "definitional dispute zone — verify against controlling authority before relying",
          "source_refs": []
        }
      ]
    },
    {
      "term_id": "person",
      "surface_forms": ["person", "persons"],
      "matrix": "identity_split",
      "confusion_with": ["natural_person", "individual", "debtor", "secured_party"],
      "mirror_hint": "Echo the speaker's use of 'person,' then note Code definitions may include organizations, not only humans.",
      "senses": [
        {
          "register": "plain",
          "epistemic": "plain",
          "definition": "A human being.",
          "authority_cite": "plain usage",
          "source_refs": []
        },
        {
          "register": "statute",
          "epistemic": "settled",
          "definition": "Under the UCC, 'person' includes an individual and an organization.",
          "authority_cite": "UCC §1-201(b)(27)",
          "source_refs": ["ucc:1-201"]
        }
      ]
    },
    {
      "term_id": "natural_person",
      "surface_forms": ["natural person", "natural persons", "individual human"],
      "matrix": "identity_split",
      "confusion_with": ["person", "individual", "debtor"],
      "mirror_hint": "Reflect 'natural person' as used; contrast with UCC 'person' which can include organizations.",
      "senses": [
        {
          "register": "plain",
          "epistemic": "plain",
          "definition": "A living human being, as opposed to a corporation or other entity.",
          "authority_cite": "plain usage",
          "source_refs": []
        },
        {
          "register": "statute",
          "epistemic": "settled",
          "definition": "An individual human; distinct from 'organization' within the UCC definition of person.",
          "authority_cite": "UCC §1-201(b)(27) (person = individual or organization)",
          "source_refs": ["ucc:1-201"]
        }
      ]
    },
    {
      "term_id": "individual",
      "surface_forms": ["individual", "individuals"],
      "matrix": "identity_split",
      "confusion_with": ["person", "natural_person"],
      "mirror_hint": "Mirror everyday use; map to Code 'individual' where relevant.",
      "senses": [
        {
          "register": "plain",
          "epistemic": "plain",
          "definition": "A single human, often contrasted with a company.",
          "authority_cite": "plain usage",
          "source_refs": []
        },
        {
          "register": "statute",
          "epistemic": "settled",
          "definition": "UCC uses 'individual' as the human half of 'person' (individual or organization).",
          "authority_cite": "UCC §1-201(b)(27)",
          "source_refs": ["ucc:1-201"]
        }
      ]
    },
    {
      "term_id": "debtor",
      "surface_forms": ["debtor", "the debtor"],
      "matrix": "identity_split",
      "confusion_with": ["secured_party", "obligor", "person"],
      "mirror_hint": "Echo who the speaker called 'debtor,' then give the Article 9 role definition.",
      "senses": [
        {
          "register": "plain",
          "epistemic": "plain",
          "definition": "Someone who owes money or has an obligation.",
          "authority_cite": "plain usage",
          "source_refs": []
        },
        {
          "register": "statute",
          "epistemic": "settled",
          "definition": "A person having an interest, other than a security interest or other lien, in the collateral — whether or not the person is an obligor.",
          "authority_cite": "UCC §9-102(a)(28)",
          "source_refs": ["ucc:9-102"]
        }
      ]
    },
    {
      "term_id": "secured_party",
      "surface_forms": ["secured party", "secured parties", "the secured party"],
      "matrix": "identity_split",
      "confusion_with": ["debtor", "creditor", "security_agreement"],
      "mirror_hint": "Reflect the speaker's party label; map to Article 9 secured-party role.",
      "senses": [
        {
          "register": "plain",
          "epistemic": "plain",
          "definition": "The lender or party who has collateral backing an obligation.",
          "authority_cite": "plain usage",
          "source_refs": []
        },
        {
          "register": "statute",
          "epistemic": "settled",
          "definition": "A person in whose favor a security interest is created or provided for under a security agreement; includes certain other lienholders and consignees as defined.",
          "authority_cite": "UCC §9-102(a)(73)",
          "source_refs": ["ucc:9-102"]
        }
      ]
    },
    {
      "term_id": "creditor",
      "surface_forms": ["creditor", "creditors"],
      "matrix": "identity_split",
      "confusion_with": ["secured_party", "debtor"],
      "mirror_hint": "Echo 'creditor' as used; note it is broader than 'secured party.'",
      "senses": [
        {
          "register": "plain",
          "epistemic": "plain",
          "definition": "Someone to whom a debt is owed.",
          "authority_cite": "plain usage",
          "source_refs": []
        },
        {
          "register": "statute",
          "epistemic": "settled",
          "definition": "Includes a general creditor, a secured creditor, a lien creditor, and any representative of creditors.",
          "authority_cite": "UCC §1-201(b)(13)",
          "source_refs": ["ucc:1-201"]
        }
      ]
    },
    {
      "term_id": "money",
      "surface_forms": ["money", "paying money", "pay money", "the money"],
      "matrix": "money_credit",
      "confusion_with": ["lawful_money", "credit", "payment", "loan"],
      "mirror_hint": "Mirror the everyday 'money' usage, then distinguish medium-of-exchange talk from credit/loan mechanics.",
      "senses": [
        {
          "register": "plain",
          "epistemic": "plain",
          "definition": "Cash or funds used to buy things or settle bills.",
          "authority_cite": "plain usage",
          "source_refs": []
        },
        {
          "register": "statute",
          "epistemic": "settled",
          "definition": "A medium of exchange currently authorized or adopted by a domestic or foreign government; includes a monetary unit of account established by an intergovernmental organization or by agreement between two or more countries.",